Бренд,Артикул,"Длина, см","Ширина, см","Высота, см",Форма,Материал,Стилистика дизайна,Цвет,Гарантия,"Глубина, см",Коллекция,Асимметричность,Монтаж,Цвет Мебели,"Диаметр слива, см",Ножки,Ценовой сегмент,Цвет профиля,Материал раковины,Покрытие фасада,Материал корпуса,Материал фасада,"Толщина стекла, мм",Поддон,Цвет стекла,Количество секций двери,Конструкция дверей,Материал профиля,Регулируемая ширина,"Ширина входа, см","Габариты с регулировками, см",Цвет сиденья,Материал сиденья,Безободковый,Арматура бачка,"Размер верхнего душа, см","Размер лейки, см",Тропический (верхний) душ,Ручной душ,"Длина шланга, см",Цвет Ручек,Управление,Отверстия для монтажа,Механизм,Ручки,Стандарт подводки,Форма излива,"Длина излива, см",Область применения,Встроенные системы,Дополнительные функции,Излив,Вращение излива,"Высота излива, см",Тип подводки,Донный клапан,Оснащение,Название,Описание,Серия см подсказку,Смеситель в комплекте,Материал столешницы,Расположение смесителя,"Объем смывн бачка, л",Метод установки сливного бачка,Режим слива воды,Направление выпуска,Подвод воды
Cezares,50224,,90,,,,современный стиль,,1  год,49,SOHO,нет,подвесной,Bianco Opaco,,,,,,,,,,,,,,,,,,,,,,,,,,,,,,,,,,,,,,,,,,,,"Акриловая раковина Solid Surface,правая CEZARES 50224",Цвет Мебели: Bianco Opaco   ,,,,,,,,,
Cezares,50229,,120,,,,современный стиль,,1  год,49,SOHO,нет,подвесной,Bianco Opaco,,,,,,,,,,,,,,,,,,,,,,,,,,,,,,,,,,,,,,,,,,,,Акриловая раковина Solid Surface с двумя чашами CEZARES 50229,Цвет Мебели: Bianco Opaco   ,,,,,,,,,
BelBagno,BB340T,,,,,,,,,,,,,,,,,,,,,,,,,,,,,,,,,,,,,,,,,,,,,,,,,,,,,,,,,Бачок BelBagno ACQUA BB340T,,,,,,,,,,
BelBagno,BB120T,,,,,,,,,,,,,,,,,,,,,,,,,,,,,,,,,,,,,,,,,,,,,,,,,,,,,,,,,Бачок BelBagno ALBANO BB120T,,,,,,,,,,
BelBagno,BB0159T,,,,,,,,,,,,,,,,,,,,,,,,,,,,,,,,,,,,,,,,,,,,,,,,,,,,,,,,,Бачок BelBagno ALPINA BB0159T,,,,,,,,,,
BelBagno,BB10100T,,,,,,,,,,,,,,,,,,,,,,,,,,,,,,,,,,,,,,,,,,,,,,,,,,,,,,,,,Бачок BelBagno ALPINA BB10100T,,,,,,,,,,
BelBagno,BB1224T,,,,,,,,,,,,,,,,,,,,,,,,,,,,,,,,,,,,,,,,,,,,,,,,,,,,,,,,,Бачок BelBagno ANCONA BB1224T,,,,,,,,,,
BelBagno,BB115T,,,,,,,,,,,,,,,,,,,,,,,,,,,,,,,,,,,,,,,,,,,,,,,,,,,,,,,,,Бачок BelBagno BOHEME BB115T,,,,,,,,,,
BelBagno,BB343T,,,,,,,,,,,,,,,,,,,,,,,,,,,,,,,,,,,,,,,,,,,,,,,,,,,,,,,,,Бачок BelBagno DELUCA BB343T,,,,,,,,,,
BelBagno,BB2157T,,,,,,,,,,,,,,,,,,,,,,,,,,,,,,,,,,,,,,,,,,,,,,,,,,,,,,,,,Бачок BelBagno ETNA BB2157T,,,,,,,,,,
BelBagno,BB006T,,,,,,,,,,,,,,,,,,,,,,,,,,,,,,,,,,,,,,,,,,,,,,,,,,,,,,,,,Бачок BelBagno FLAY-R BB006T,,,,,,,,,,
BelBagno,BB541T,,,,,,,,,,,,,,,,,,,,,,,,,,,,,,,,,,,,,,,,,,,,,,,,,,,,,,,,,Бачок BelBagno GENIUS BB541T,,,,,,,,,,
BelBagno,BB124T,,,,,,,,,,,,,,,,,,,,,,,,,,,,,,,,,,,,,,,,,,,,,,,,,,,,,,,,,Бачок BelBagno JANICE BB124T,,,,,,,,,,
BelBagno,BB128T,,,,,,,,,,,,,,,,,,,,,,,,,,,,,,,,,,,,,,,,,,,,,,,,,,,,,,,,,Бачок BelBagno LAGO BB128T,,,,,,,,,,
BelBagno,BB118T,,,,,,,,,,,,,,,,,,,,,,,,,,,,,,,,,,,,,,,,,,,,,,,,,,,,,,,,,Бачок BelBagno MARCO BB118T,,,,,,,,,,
BelBagno,BB105T,,,,,,,,,,,,,,,,,,,,,,,,,,,,,,,,,,,,,,,,,,,,,,,,,,,,,,,,,Бачок BelBagno MARINO BB105T,,,,,,,,,,
BelBagno,BB1060T,,,,,,,,,,,,,,,,,,,,,,,,,,,,,,,,,,,,,,,,,,,,,,,,,,,,,,,,,Бачок BelBagno MATTINO BB1060T,,,,,,,,,,
BelBagno,BB806T,,,,,,,,,,,,,,,,,,,,,,,,,,,,,,,,,,,,,,,,,,,,,,,,,,,,,,,,,Бачок BelBagno MONICA BB806T,,,,,,,,,,
BelBagno,BB339T,,,,,,,,,,,,,,,,,,,,,,,,,,,,,,,,,,,,,,,,,,,,,,,,,,,,,,,,,Бачок BelBagno NORMA BB339T,,,,,,,,,,
BelBagno,BB10150T,,,,,,,,,,,,,,,,,,,,,,,,,,,,,,,,,,,,,,,,,,,,,,,,,,,,,,,,,Бачок BelBagno PRADO BB10150T,,,,,,,,,,
BelBagno,BB104T,,,,,,,,,,,,,,,,,,,,,,,,,,,,,,,,,,,,,,,,,,,,,,,,,,,,,,,,,Бачок BelBagno REGINA BB104T,,,,,,,,,,
BelBagno,BB275T,,,,,,,,,,,,,,,,,,,,,,,,,,,,,,,,,,,,,,,,,,,,,,,,,,,,,,,,,Бачок BelBagno RICCO BB275T,,,,,,,,,,
BelBagno,BB248T,,,,,,,,,,,,,,,,,,,,,,,,,,,,,,,,,,,,,,,,,,,,,,,,,,,,,,,,,Бачок BelBagno ROMANO BB248T,,,,,,,,,,
BelBagno,BB121T,,,,,,,,,,,,,,,,,,,,,,,,,,,,,,,,,,,,,,,,,,,,,,,,,,,,,,,,,Бачок BelBagno ROMINA BB121T,,,,,,,,,,
BelBagno,BB122T,,,,,,,,,,,,,,,,,,,,,,,,,,,,,,,,,,,,,,,,,,,,,,,,,,,,,,,,,Бачок BelBagno SABRINA BB122T,,,,,,,,,,
BelBagno,BB006T,,,,,,,,,,,,,,,,,,,,,,,,,,,,,,,,,,,,,,,,,,,,,,,,,,,,,,,,,Бачок BelBagno SFERA-R BB006T,,,,,,,,,,
BelBagno,BB130T,,,,,,,,,,,,,,,,,,,,,,,,,,,,,,,,,,,,,,,,,,,,,,,,,,,,,,,,,Бачок BelBagno STEAM BB130T,,,,,,,,,,
BelBagno,BB127T,,,,,,,,,,,,,,,,,,,,,,,,,,,,,,,,,,,,,,,,,,,,,,,,,,,,,,,,,Бачок BelBagno VASO BB127T,,,,,,,,,,
BelBagno,BB520T,,,,,,,,,,,,,,,,,,,,,,,,,,,,,,,,,,,,,,,,,,,,,,,,,,,,,,,,,Бачок BelBagno VELLA-R BB520T,,,,,,,,,,
BelBagno,BB319T,,,,,,,,,,,,,,,,,,,,,,,,,,,,,,,,,,,,,,,,,,,,,,,,,,,,,,,,,Бачок BelBagno VISTO BB319T,,,,,,,,,,
Cezares,CZR-012T,,,,,,,,,,,,,,,,,,,,,,,,,,,,,,,,,,,,,,,,,,,,,,,,,,,,,,,,,Бачок CEZARES CZR-012T,,,,,,,,,,
BelBagno,BB114B,,"50,5",41,,санитарный фаянс,,,25 лет,"35,5",ALDINA,,на пол,,,,,,,,,,,,,,,,,,,,,,,,,,,,,,,,,,,,,,,,,,,,,Биде напольное BelBagno ALDINA BB114B,"Смеситель в комплект не входит, приобретается отдельно.",,нет,,,,,,,
BelBagno,BB10100B,,52,40,,санитарный фаянс,,,25 лет,"35,5",Alpina,,на пол,,,,,,,,,,,,,,,,,,,,,,,,,,,,,,,,,,,,,,,,,,,,,Биде напольное BelBagno ALPINA BB10100B,"Смеситель в комплект не входит, приобретается отдельно.",,нет,,,,,,,
BelBagno,BB105B,,54,40,,санитарный фаянс,,,25 лет,33,Marino,,на пол,,,,,,,,,,,,,,,,,,,,,,,,,,,,,,,,,,,,,,,,,,,,,Биде напольное BelBagno MARINO BB105B,"Смеситель в комплект не входит, приобретается отдельно.",,нет,,,,,,,
BelBagno,BB1060B,,50,40,,санитарный фаянс,,,25 лет,36,Mattino,,на пол,,,,,,,,,,,,,,,,,,,,,,,,,,,,,,,,,,,,,,,,,,,,,Биде напольное BelBagno MATTINO BB1060B,"Смеситель в комплект не входит, приобретается отдельно.",,нет,,,,,,,
BelBagno,BB10150B,,54,40,,санитарный фаянс,,,25 лет,36,Prado,,на пол,,,,,,,,,,,,,,,,,,,,,,,,,,,,,,,,,,,,,,,,,,,,,Биде напольное BelBagno PRADO,"Смеситель в комплект не входит, приобретается отдельно.",,нет,,,,,,,
BelBagno,BB829B,,"58,5","40,5",,санитарный фаянс,,,25 лет,"37,5",Vella,,на пол,,,,,,,,,,,,,,,,,,,,,,,,,,,,,,,,,,,,,,,,,,,,,Биде напольное BelBagno VELLA BB829B,"Смеситель в комплект не входит, приобретается отдельно.",,нет,,,,,,,
BelBagno,BB114BH,,51,"31,5",,санитарный фаянс,,,25 лет,"35,5",ALDINA,,подвесной,,,,,,,,,,,,,,,,,,,,,,,,,,,,,,,,,,,,,,,,,,,,,Биде подвесное BelBagno ALDINA BB114BH,"Смеситель к комплект не входит, приобретается отдельно.",,нет,,,,,,,
BelBagno,BB10100BH,,52,30,,санитарный фаянс,,,25 лет,"35,5",Alpina,,подвесной,,,,,,,,,,,,,,,,,,,,,,,,,,,,,,,,,,,,,,,,,,,,,Биде подвесное BelBagno ALPINA BB10100BH,"Смеситель к комплект не входит, приобретается отдельно.",,нет,,,,,,,
BelBagno,BB1104BH,,52,30,,санитарный фаянс,,,25 лет,"37,5",,,подвесной,,,,,,,,,,,,,,,,,,,,,,,,,,,,,,,,,,,,,,,,,,,,,Биде подвесное BelBagno GENOVA BB1104BH,"Смеситель к комплект не входит, приобретается отдельно.",,нет,,,,,,,
BelBagno,BB105BH,,52,"29,5",,санитарный фаянс,,,25 лет,"35,5",Marino,,подвесной,,,,,,,,,,,,,,,,,,,,,,,,,,,,,,,,,,,,,,,,,,,,,Биде подвесное BelBagno MARINO BB105BH,"Смеситель к комплект не входит, приобретается отдельно.",,нет,,,,,,,
BelBagno,BB10150BH,,52,"29,5",,санитарный фаянс,,,25 лет,36,Prado,,подвесной,,,,,,,,,,,,,,,,,,,,,,,,,,,,,,,,,,,,,,,,,,,,,Биде подвесное BelBagno PRADO,"Смеситель к комплект не входит, приобретается отдельно.",,нет,,,,,,,
Cezares,CZR-618-TH,,54,30,,санитарный фаянс,,,25 лет,39,King Palace,,подвесной,,,,,,,,,,,,,,,,,,,,,,,,,,,,,,,,,,,,,,,,,,,,,Биде подвесное CEZARES KING PALACE CZR-618-TH,"Биде подвесное без сиденья

 • Габаритные размеры: 540х396х300

 • Отверстия под смеситель: 1 отверстие

 • Гарантия 25 лет на фаянс
 
ОБРАТИТЕ ВНИМАНИЕ: смеситель в комплект не входит ",,нет,,,,,,,
BelBagno,BB120CP,,,,,,,,,,,,,,,,,,,,,,,,,,,,,,,,,,,,,,,,,,,,,,,,,,,,,,,,,"Чаша безободкового унитаза, P-trap BelBagno ALBANO BB120CPR",,,,,,,,,,
BelBagno,BB1060CPR,,,,,,,,,,,,,,,,,,,,,,,,,,,,,,,,,,,,,,,,,,,,,,,,,,,,,,,,,"Чаша безободкового унитаза, P-trap BelBagno MATTINO BB1060CPR",,,,,,,,,,
BelBagno,BB104CP,,,,,,,,,,,,,,,,,,,,,,,,,,,,,,,,,,,,,,,,,,,,,,,,,,,,,,,,,"Чаша безободкового унитаза, P-trap BelBagno REGINA BB104CP",,,,,,,,,,
BelBagno,BB127CP,,,,,,,,,,,,,,,,,,,,,,,,,,,,,,,,,,,,,,,,,,,,,,,,,,,,,,,,,"Чаша безободкового унитаза, P-trap BelBagno VASO BB127CP",,,,,,,,,,
BelBagno,BB135CP,,,,,,,,,,,,,,,,,,,,,,,,,,,,,,,,,,,,,,,,,,,,,,,,,,,,,,,,,Чаша унитаза BelBagno TREVI BB135CP,,,,,,,,,,
BelBagno,BB0159CPR,,,,,,,,,,,,,,,,,,,,,,,,,,,,,,,,,,,,,,,,,,,,,,,,,,,,,,,,,"Чаша унитаза безободкового, P-trap BelBagno ALPINA BB0159CPR",,,,,,,,,,
BelBagno,BB115CPR,,,,,,,,,,,,,,,,,,,,,,,,,,,,,,,,,,,,,,,,,,,,,,,,,,,,,,,,,"Чаша унитаза безободкового, P-trap BelBagno BOHEME BB115CPR",,,,,,,,,,
BelBagno,BB007CPR,,,,,,,,,,,,,,,,,,,,,,,,,,,,,,,,,,,,,,,,,,,,,,,,,,,,,,,,,"Чаша унитаза безободкового, P-trap BelBagno FLY-R BB007CPR",,,,,,,,,,
BelBagno,BB124CP,,,,,,,,,,,,,,,,,,,,,,,,,,,,,,,,,,,,,,,,,,,,,,,,,,,,,,,,,"Чаша унитаза, P-trap BelBagno JANICE BB124CP",,,,,,,,,,
BelBagno,BB006CPR,,,,,,,,,,,,,,,,,,,,,,,,,,,,,,,,,,,,,,,,,,,,,,,,,,,,,,,,,"Чаша унитаза безободкового, P-trap BelBagno SFERA-R BB006CPR",,,,,,,,,,
BelBagno,BB340CPR,,,,,,,,,,,,,,,,,,,,,,,,,,,,,,,,,,,,,,,,,,,,,,,,,,,,,,,,,"Чаша унитаза, P-trap BelBagno ACQUA BB340CPR",,,,,,,,,,
BelBagno,BB120CP,,,,,,,,,,,,,,,,,,,,,,,,,,,,,,,,,,,,,,,,,,,,,,,,,,,,,,,,,"Чаша унитаза, P-trap BelBagno ALBANO BB120CP",,,,,,,,,,
BelBagno,BB10100CP,,,,,,,,,,,,,,,,,,,,,,,,,,,,,,,,,,,,,,,,,,,,,,,,,,,,,,,,,"Чаша унитаза, P-trap BelBagno ALPINA BB10100CP",,,,,,,,,,
BelBagno,BB1224CPR-P,,,,,,,,,,,,,,,,,,,,,,,,,,,,,,,,,,,,,,,,,,,,,,,,,,,,,,,,,"Чаша унитаза, P-trap BelBagno ANCONA BB1224CPR-P",,,,,,,,,,
BelBagno,BB115CP,,,,,,,,,,,,,,,,,,,,,,,,,,,,,,,,,,,,,,,,,,,,,,,,,,,,,,,,,"Чаша унитаза, P-trap BelBagno BOHEME BB115CP",,,,,,,,,,
BelBagno,BB343CPR,,,,,,,,,,,,,,,,,,,,,,,,,,,,,,,,,,,,,,,,,,,,,,,,,,,,,,,,,"Чаша унитаза, P-trap BelBagno DELUCA BB343CPR",,,,,,,,,,
BelBagno,BB2157CPR,,,,,,,,,,,,,,,,,,,,,,,,,,,,,,,,,,,,,,,,,,,,,,,,,,,,,,,,,"Чаша унитаза, P-trap BelBagno ETNA BB2157CPR",,,,,,,,,,
BelBagno,BB007CPR,,,,,,,,,,,,,,,,,,,,,,,,,,,,,,,,,,,,,,,,,,,,,,,,,,,,,,,,,"Чаша унитаза, P-trap BelBagno FLAY-R BB007CPR",,,,,,,,,,
BelBagno,BB541CP,,,,,,,,,,,,,,,,,,,,,,,,,,,,,,,,,,,,,,,,,,,,,,,,,,,,,,,,,"Чаша унитаза, P-trap BelBagno GENIUS BB541CP",,,,,,,,,,
BelBagno,BB118CP,,,,,,,,,,,,,,,,,,,,,,,,,,,,,,,,,,,,,,,,,,,,,,,,,,,,,,,,,"Чаша унитаза, P-trap BelBagno LAGO BB128CP",,,,,,,,,,
BelBagno,BB118CP,,,,,,,,,,,,,,,,,,,,,,,,,,,,,,,,,,,,,,,,,,,,,,,,,,,,,,,,,"Чаша унитаза, P-trap BelBagno MARCO BB118CP",,,,,,,,,,
BelBagno,BB105CP,,,,,,,,,,,,,,,,,,,,,,,,,,,,,,,,,,,,,,,,,,,,,,,,,,,,,,,,,"Чаша унитаза, P-trap BelBagno MARINO BB105CP",,,,,,,,,,
BelBagno,BB105CPR,,,,,,,,,,,,,,,,,,,,,,,,,,,,,,,,,,,,,,,,,,,,,,,,,,,,,,,,,"Чаша безободкового унитаза, P-trap BelBagno MARINO BB105CPR",,,,,,,,,,
BelBagno,BB1060CP,,,,,,,,,,,,,,,,,,,,,,,,,,,,,,,,,,,,,,,,,,,,,,,,,,,,,,,,,"Чаша унитаза, P-trap BelBagno MATTINO BB1060CP",,,,,,,,,,
BelBagno,BB805CPR,,,,,,,,,,,,,,,,,,,,,,,,,,,,,,,,,,,,,,,,,,,,,,,,,,,,,,,,,"Чаша унитаза, P-trap BelBagno MONICA BB805CPR",,,,,,,,,,
BelBagno,BB339CPR,,,,,,,,,,,,,,,,,,,,,,,,,,,,,,,,,,,,,,,,,,,,,,,,,,,,,,,,,"Чаша унитаза, P-trap BelBagno NORMA BB339CPR",,,,,,,,,,
BelBagno,BB10150CP,,,,,,,,,,,,,,,,,,,,,,,,,,,,,,,,,,,,,,,,,,,,,,,,,,,,,,,,,"Чаша унитаза, P-trap BelBagno PRADO BB10150CP",,,,,,,,,,
BelBagno,BB275CPR,,,,,,,,,,,,,,,,,,,,,,,,,,,,,,,,,,,,,,,,,,,,,,,,,,,,,,,,,"Чаша унитаза, P-trap BelBagno RICCO BB275CPR",,,,,,,,,,
BelBagno,BB248CPR-P,,,,,,,,,,,,,,,,,,,,,,,,,,,,,,,,,,,,,,,,,,,,,,,,,,,,,,,,,"Чаша унитаза, P-trap BelBagno ROMANO BB248CPR-P",,,,,,,,,,
BelBagno,BB121CP,,,,,,,,,,,,,,,,,,,,,,,,,,,,,,,,,,,,,,,,,,,,,,,,,,,,,,,,,"Чаша унитаза, P-trap BelBagno ROMINA BB121CP",,,,,,,,,,
BelBagno,BB122CP,,,,,,,,,,,,,,,,,,,,,,,,,,,,,,,,,,,,,,,,,,,,,,,,,,,,,,,,,"Чаша унитаза, P-trap BelBagno SABRINA BB122CP",,,,,,,,,,
BelBagno,BB130CPR,,,,,,,,,,,,,,,,,,,,,,,,,,,,,,,,,,,,,,,,,,,,,,,,,,,,,,,,,"Чаша унитаза, P-trap BelBagno STEAM BB130CPR",,,,,,,,,,
BelBagno,BB620CPR,,,,,,,,,,,,,,,,,,,,,,,,,,,,,,,,,,,,,,,,,,,,,,,,,,,,,,,,,"Чаша унитаза, P-trap BelBagno VELLA-R BB620CPR",,,,,,,,,,
BelBagno,BB319CPR,,,,,,,,,,,,,,,,,,,,,,,,,,,,,,,,,,,,,,,,,,,,,,,,,,,,,,,,,"Чаша унитаза, P-trap BelBagno VISTO BB319CPR",,,,,,,,,,
BelBagno,BB10150CH,,,,,,,,,,,,,,,,,,,,,,,,,,,,,,,,,,,,,,,,,,,,,,,,,,,,,,,,,"Чаша унитаза подвесного, безободкового BelBagno PRADO BB10150CH",,,,,,,,,,
BelBagno,BB115CB,,,,,,,,,,,,,,,,,,,,,,,,,,,,,,,,,,,,,,,,,,,,,,,,,,,,,,,,,"Чаша унитаза приставного, P-trap BelBagno BOHEME BB115CB",,,,,,,,,,
BelBagno,BB10150CB,,,,,,,,,,,,,,,,,,,,,,,,,,,,,,,,,,,,,,,,,,,,,,,,,,,,,,,,,"Чаша унитаза приставного, P-trap BelBagno PRADO BB10150CB",,,,,,,,,,
BelBagno,BB115CBS,,,,,,,,,,,,,,,,,,,,,,,,,,,,,,,,,,,,,,,,,,,,,,,,,,,,,,,,,"Чаша унитаза приставного, S-trap BelBagno BOHEME BB115CBS",,,,,,,,,,
Cezares,CZR-012,,,,,,,,,,,,,,,,,,,,,,,,,,,,,,,,,,,,,,,,,,,,,,,,,,,,,,,,,Чаша унитаза с горизонтальным выпуском P-Trape CEZARES CZR-012 ROYAL ALACE ,,,,,,,,,,
BelBagno,BB115CPS,,,,,,,,,,,,,,,,,,,,,,,,,,,,,,,,,,,,,,,,,,,,,,,,,,,,,,,,,"Чаша унитаза, S-trap BelBagno BOHEME BB115CPS",,,,,,,,,,
ART&MAX,AM-4881AQ,,,,,,,бронза,1  год,,,,,,,,,,,,,,,,,,,,,,,,,,,,,,,,,,,,,,,,,,,,,,,,,Держатель щетки для унитаза подвесной ART&MAX AM-4881AQ,,,,,,,,,,
ART&MAX,AM-B-0911-T,,,,,,,серебро,1  год,,,,,,,,,,,,,,,,,,,,,,,,,,,,,,,,,,,,,,,,,,,,,,,,,Держатель щетки для унитаза подвесной ART&MAX AM-B-0911-T ,,,,,,,,,,
ART&MAX,AM-G-6839-Bi,,,,,,,белый,1  год,,,,,,,,,,,,,,,,,,,,,,,,,,,,,,,,,,,,,,,,,,,,,,,,,Держатель щетки для унитаза подвесной ART&MAX AM-G-6839-Bi,,,,,,,,,,
ART&MAX,AM-G-6839,,,,,,,хром,1  год,,,,,,,,,,,,,,,,,,,,,,,,,,,,,,,,,,,,,,,,,,,,,,,,,Держатель щетки для унитаза подвесной ART&MAX AM-G-6839,,,,,,,,,,
ART&MAX,AM-G-7839,,,,,,,хром,1  год,,,,,,,,,,,,,,,,,,,,,,,,,,,,,,,,,,,,,,,,,,,,,,,,,Держатель щетки для унитаза подвесной ART&MAX AM-G-7839,,,,,,,,,,
Cezares,50200,,101,1.8,,,,,,46,,,,,,,,,керамика,,,,,,,,,,,,,,,,,,,,,,,,,,,,,,,,,,,,,,,Керамическая раковина 101x46x19 Cezares 50200,,,,,,,,,,
Cezares,50200,,101,,,,современный стиль,,1  год,46,,нет,подвесной,,,,,,,,,,,,,,,,,,,,,,,,,,,,,,,,,,,,,,,,,,,,,Керамическая раковина 50200 Bianco,,,,,,,,,,
Cezares,50201,,75,,,,современный стиль,,1  год,46,,нет,подвесной,,,,,,,,,,,,,,,,,,,,,,,,,,,,,,,,,,,,,,,,,,,,,Керамическая раковина 50201 Bianco,,,,,,,,,,
Cezares,50202,,61,,,,современный стиль,,1  год,46,,нет,подвесной,,,,,,,,,,,,,,,,,,,,,,,,,,,,,,,,,,,,,,,,,,,,,Керамическая раковина 50202 Bianco,,,,,,,,,,
Cezares,50201,,75,19,,,,,,46,,,,,,,,,,,,,,,,,,,,,,,,,,,,,,,,,,,,,,,,,,,,,,,,Керамическая раковина 75x46x19 Cezares 50201,,,,,,,,,,
BelBagno,PRADO-800-LVB,,,,,,,,,,,,,Bianco Lucido,,,,,,,,,,,,,,,,,,,,,,,,,,,,,,,,,,,,,,,,,,,,Керамическая раковина BelBagno PRADO-800-LVB,Цвет Мебели: Bianco Lucido   ,,,,,,,,,
Cezares,50132,,,,,,,,,,,,,,,,,,,,,,,,,,,,,,,,,,,,,,,,,,,,,,,,,,,,,,,,,Керамическая раковина CEZARES 50132,,,,,,,,,,
Cezares,50135,,121,"1,8",,,,,,46,,,,,,,,,керамика,,,,,,,,,,,,,,,,,,,,,,,,,,,,,,,,,,,,,,,Керамическая раковина с двумя чашами 120 см CEZARES 50135,,,,,,,,,,
Cezares,CZR-FIX-FLR-Br,,,,,,,,,,,,,,,,,,,,,,,,,,,,,,,,,,,,,,,,,,,,,,,,,,,,,,,,,"Крепеж к напольному унитазу, бронза CEZARES CZR-FIX-FLR-Br",,,,,,,,,,
Cezares,CZR-FIX-FLR-G,,,,,,,,,,,,,,,,,,,,,,,,,,,,,,,,,,,,,,,,,,,,,,,,,,,,,,,,,"Крепеж к напольному унитазу, золото CEZARES CZR-FIX-FLR-G",,,,,,,,,,
BelBagno,BB120P,,19,73,,,,,25 лет,16,Albano,,,,,,,,,,,,,,,,,,,,,,,,,,,,,,,,,,,,,,,,,,,,,,,Пьедестал BelBagno ALBANO BB120P,Пьедестал под раковину,,,,,,,,,
BelBagno,BB540P,,"15,5",72,,,,,25 лет,14,Alise,,,,,,,,,,,,,,,,,,,,,,,,,,,,,,,,,,,,,,,,,,,,,,,Пьедестал BelBagno ALISE BB540P,Пьедестал под раковину,,,,,,,,,
BelBagno,BB10100P,,,71,,,,,25 лет,,Alpina,,,,,,,,,,,,,,,,,,,,,,,,,,,,,,,,,,,,,,,,,,,,,,,Пьедестал BelBagno ALPINA BB10100P,Пьедестал под раковину,,,,,,,,,
BelBagno,,,,,,,,,,,,,,,,,,,,,,,,,,,,,,,,,,,,,,,,,,,,,,,,,,,,,,,,,,Пьедестал BelBagno BOHEME,,,,,,,,,,
BelBagno,BB0102P,,18,71,,,,,25 лет,,Flay,,,,,,,,,,,,,,,,,,,,,,,,,,,,,,,,,,,,,,,,,,,,,,,Пьедестал BelBagno FLAY BB0102P,Пьедестал под раковину,,,,,,,,,
BelBagno,BB128P,,,,,,,,25 лет,,LAGO,,,,,,,,,,,,,,,,,,,,,,,,,,,,,,,,,,,,,,,,,,,,,,,Пьедестал BelBagno LAGO BB128P,Пьедестал под раковину,,,,,,,,,
BelBagno,BB105P,,"15,5",72,,,,,25 лет,14,Marino,,,,,,,,,,,,,,,,,,,,,,,,,,,,,,,,,,,,,,,,,,,,,,,Пьедестал BelBagno MARINO BB105P,Пьедестал под раковину,,,,,,,,,
BelBagno,BB1060P,,,69,,,,,25 лет,,Mattino,,,,,,,,,,,,,,,,,,,,,,,,,,,,,,,,,,,,,,,,,,,,,,,Пьедестал BelBagno MATTINO BB1060P,Пьедестал под раковину,,,,,,,,,
BelBagno,BB104P,,22,73,,,,,25 лет,19,Sabrina,,,,,,,,,,,,,,,,,,,,,,,,,,,,,,,,,,,,,,,,,,,,,,,Пьедестал BelBagno REGINA BB104P,Пьедестал под раковину,,,,,,,,,
BelBagno,BB121P,,19,72,,,,,25 лет,"15,7",Romina,,,,,,,,,,,,,,,,,,,,,,,,,,,,,,,,,,,,,,,,,,,,,,,Пьедестал BelBagno ROMINA BB121P,Пьедестал под раковину,,,,,,,,,
BelBagno,BB122P,,"18,5",71,,,,,25 лет,16,Sabrina,,,,,,,,,,,,,,,,,,,,,,,,,,,,,,,,,,,,,,,,,,,,,,,Пьедестал BelBagno SABRINA BB122P,Пьедестал под раковину,,,,,,,,,
BelBagno,BB8295P,,"17,5",69,,,,,25 лет,"18,5",Vella,,,,,,,,,,,,,,,,,,,,,,,,,,,,,,,,,,,,,,,,,,,,,,,Пьедестал BelBagno VELLA BB8295P,Пьедестал под раковину,,,,,,,,,
Cezares,CZR-431-T,,,67,,,,,25 лет,,King Palace,,,,,,,,,,,,,,,,,,,,,,,,,,,,,,,,,,,,,,,,,,,,,,,Пьедестал CEZARES King Palace CZR-431-T,Пьедестал под раковину,,,,,,,,,
BelBagno,BB120PH,,,,,,,,25 лет,,Albano,,,,,,,,,,,,,,,,,,,,,,,,,,,,,,,,,,,,,,,,,,,,,,,Полупьедестал BelBagno ALBANO BB120PH,Полупьедестал под раковину,,,,,,,,,
BelBagno,BB128PH,,,,,,,,25 лет,,LAGO,,,,,,,,,,,,,,,,,,,,,,,,,,,,,,,,,,,,,,,,,,,,,,,Полупьедестал BelBagno LAGO BB128PH,Полупьедестал под раковину,,,,,,,,,
BelBagno,BB105PH,,,,,,,,25 лет,,Marino,,,,,,,,,,,,,,,,,,,,,,,,,,,,,,,,,,,,,,,,,,,,,,,Полупьедестал BelBagno MARINO BB105PH,Полупьедестал под раковину,,,,,,,,,
BelBagno,BB122PH,,,,,,,,25 лет,,Sabrina,,,,,,,,,,,,,,,,,,,,,,,,,,,,,,,,,,,,,,,,,,,,,,,Полупьедестал BelBagno SABRINA BB122PH,Полупьедестал под раковину,,,,,,,,,
BelBagno,BB8295PH,,"20,5",27,,,,,25 лет,"25,5",Vella,,,,,,,,,,,,,,,,,,,,,,,,,,,,,,,,,,,,,,,,,,,,,,,Полупьедестал BelBagno VELLA BB8295PH,Полупьедестал под раковину,,,,,,,,,
Cezares,50195,,,,,,,,,,,,,,,,,,,,,,,,,,,,,,,,,,,,,,,,,,,,,,,,,,,,,,,,,Раковина из искуcственного мрамора CEZARES 50195,,,,,,,,,,
Cezares,50170,,101,"1,8",,,современный стиль,,,46,,,,,,,,,из искусственного мрамора,,,,,,,,,,,,,,,,,,,,,,,,,,,,,,,,,,,,,,,"Раковина из искусственного мрамора 101x46x2,550170",,,,,,,,,,
Cezares,50211,,120,"2,5",,,,,,46,,,,,,,,,,,,,,,,,,,,,,,,,,,,,,,,,,,,,,,,,,,,,,,,Раковина из искусственного мрамора 120см CEZARES 50211,,,,,,,,,,
Cezares,50203,,61,,,,современный стиль,,1  год,46,,нет,подвесной,,,,,,,,,,,,,,,,,,,,,,,,,,,,,,,,,,,,,,,,,,,,,Раковина из искусственного мрамора 50203 Bianco,,,,,,,,,,
Cezares,50169,,75,"2,5",,,современный стиль,,,46,,,,,,,,,из искусственного мрамора,,,,,,,,,,,,,,,,,,,,,,,,,,,,,,,,,,,,,,,Раковина из искусственного мрамора 75см CEZARES 50169,,,,,,,,,,
BelBagno,AM-LAV-1000-MR-A,,,,,,,,,,,,,,,,,,из искусственного мрамора,,,,,,,,,,,,,,,,,,,,,,,,,,,,,,,,,,,,,,,Раковина из искусственного мрамора AM-LAV-1000-MR-A,,,,,,,,,,
BelBagno,AM-LAV-1000-MR-FP,,,,,,,,,,,,,,,,,,из искусственного мрамора,,,,,,,,,,,,,,,,,,,,,,,,,,,,,,,,,,,,,,,Раковина из искусственного мрамора AM-LAV-1000-MR-FP,,,,,,,,,,
BelBagno,AM-LAV-580-MR-A,,,,,,,,,,,,,,,,,,из искусственного мрамора,,,,,,,,,,,,,,,,,,,,,,,,,,,,,,,,,,,,,,,Раковина из искусственного мрамора AM-LAV-580-MR-A,,,,,,,,,,
BelBagno,AM-LAV-750-MR-A,,,,,,,,,,,,,,,,,,из искусственного мрамора,,,,,,,,,,,,,,,,,,,,,,,,,,,,,,,,,,,,,,,Раковина из искусственного мрамора AM-LAV-750-MR-A,,,,,,,,,,
BelBagno,AM-LAV-750-MR-FP,,,,,,,,,,,,,,,,,,из искусственного мрамора,,,,,,,,,,,,,,,,,,,,,,,,,,,,,,,,,,,,,,,Раковина из искусственного мрамора AM-LAV-750-MR-FP,,,,,,,,,,
BelBagno,AM-LAV-900-MR-A,,,,,,,,,,,,,,,,,,из искусственного мрамора,,,,,,,,,,,,,,,,,,,,,,,,,,,,,,,,,,,,,,,Раковина из искусственного мрамора AM-LAV-900-MR-A,,,,,,,,,,
BelBagno,AM-LAV-900-MR-FP,,,,,,,,,,,,,,,,,,из искусственного мрамора,,,,,,,,,,,,,,,,,,,,,,,,,,,,,,,,,,,,,,,Раковина из искусственного мрамора AM-LAV-900-MR-FP,,,,,,,,,,
BelBagno,BB1000/455-LV-MR-ALR,,,,,,,,,,,,,,,,,,из искусственного мрамора,,,,,,,,,,,,,,,,,,,,,,,,,,,,,,,,,,,,,,,Раковина из искусственного мрамора BB1000/455-LV-MR-ALR,,,,,,,,,,
BelBagno,BB800/455-LV-MR-ALR,,,,,,,,,,,,,,,,,,из искусственного мрамора,,,,,,,,,,,,,,,,,,,,,,,,,,,,,,,,,,,,,,,Раковина из искусственного мрамора BB800/455-LV-MR-ALR,,,,,,,,,,
BelBagno,BB900/455-LV-MR-ALR,,,,,,,,,,,,,,,,,,из искусственного мрамора,,,,,,,,,,,,,,,,,,,,,,,,,,,,,,,,,,,,,,,Раковина из искусственного мрамора BB900/455-LV-MR-ALR,,,,,,,,,,
BelBagno,BB1000/445-LV-MR-PR,,100,,,,,,,"45,5",,,,,,,,,из искусственного мрамора,,,,,,,,,,,,,,,,,,,,,,,,,,,,,,,,,,,,,,,Раковина из искусственного мрамора BelBagno BB1000/445-LV-MR-PR,,,,,,,,,,
BelBagno,BB1000/450-LV-MR-AST,,100,,,,,,,45,,,,,,,,,из искусственного мрамора,,,,,,,,,,,,,,,,,,,,,,,,,,,,,,,,,,,,,,,Раковина из искусственного мрамора BelBagno BB1000/450-LV-MR-AST,,,,,,,,,,
